{"$schema":"https://json-schema.org/draft/2020-12/schema","additionalProperties":false,"properties":{"allow_unknown_cost":{"title":"Allow Unknown Cost","type":"boolean"},"approval_id":{"maxLength":256,"minLength":1,"title":"Approval Id","type":"string"},"approved_keyframe_result_id":{"anyOf":[{"maxLength":256,"minLength":1,"type":"string"},{"type":"null"}],"title":"Approved Keyframe Result Id"},"approved_variant_ids":{"items":{"maxLength":256,"minLength":1,"type":"string"},"minItems":1,"title":"Approved Variant Ids","type":"array"},"contract_version":{"const":"1.0","title":"Contract Version","type":"string"},"created_at":{"pattern":"^\\d{4}-\\d{2}-\\d{2}T\\d{2}:\\d{2}:\\d{2}(?:\\.\\d+)?Z$","title":"Created At","type":"string"},"document_sha256":{"pattern":"^sha256:[0-9a-f]{64}$","title":"Document Sha256","type":"string"},"execution_mode":{"enum":["keyframes","video"],"title":"Execution Mode","type":"string"},"idempotency_key":{"maxLength":256,"minLength":1,"title":"Idempotency Key","type":"string"},"max_estimated_cost_usd":{"anyOf":[{"minimum":0,"type":"number"},{"type":"null"}],"title":"Max Estimated Cost Usd"},"plan_id":{"maxLength":256,"minLength":1,"title":"Plan Id","type":"string"},"plan_sha256":{"pattern":"^sha256:[0-9a-f]{64}$","title":"Plan Sha256","type":"string"},"request_id":{"maxLength":256,"minLength":1,"title":"Request Id","type":"string"}},"required":["contract_version","created_at","document_sha256","approval_id","request_id","plan_id","plan_sha256","execution_mode","approved_variant_ids","approved_keyframe_result_id","idempotency_key","allow_unknown_cost","max_estimated_cost_usd"],"title":"PlanApproval","type":"object"}