{"allow_unknown_cost":true,"approval_id":"approval-launch-film-r4","approved_keyframe_result_id":null,"approved_variant_ids":["scene-04-primary"],"contract_version":"1.0","created_at":"2026-07-20T18:05:00Z","document_sha256":"sha256:60b94e7cfda23a05a11cf5052bb35c5bdb71a9a564afb99f648753b68a7f25f1","execution_mode":"video","idempotency_key":"sha256:aaaaaaaaaaaaaaaaaaaaaaaaaaaaaaaaaaaaaaaaaaaaaaaaaaaaaaaaaaaaaaaa","max_estimated_cost_usd":40,"plan_id":"genplan-launch-film-r4","plan_sha256":"sha256:9147dfadf7966e2408c742d449731c3f32fb3513cf4eb143436f233864d43e7e","request_id":"genreq-launch-film-r4"}